Non-terrorist,Revolutionary Association of Women in Afghanistan (RAWA),4,0,0,Afghanistan,2006,1,Unknown,Follower,RAWA member speech in the Conference on South Asian Education Systems,"Dear sisters and friends,

First of all, on behalf of Revolutionary Association of the Women of Afghanistan (RAWA), I would like to thank Alliance for Education Development (AFED) and especially Tahira Abdullah, who has always been an activist and freedom-loving woman who expresses her love and solidarity with RAWA. It’s mainly because of her that I have the opportunity to participate in the conference on Girls Education.

RAWA is the oldest political/social organization of Afghan women, struggling for peace, freedom, democracy and women’s rights in fundamentalism-blighted Afghanistan since 1977. Education has been the main focus and priority issue of RAWA, and we strongly believe that only the weapon of education can empower the women of Afghanistan to gain political awareness and participate actively in struggle against fundamentalists. Because of this very fact, despite various problems and obstacles as well as insufficient resources, RAWA has taken the responsibility to administrate hundreds of literacy courses, schools and orphanages in Afghanistan and Pakistan based on its own teaching policy, promoting free-thinking and equality among all people regardless of gender, race or religion.

In countries like Afghanistan, issues such as education can not be understood without taking into account the whole political system. But no doubt, the decades of war from 1979 through the present has badly affected the education sector and deprived a generation of the opportunity to be educated. The puppet regime of Russia destroyed our educational system in the name of democracy and women’s rights, the fundamentalist Jehadis were first who not only called doors of schools “gateways to hell”, but also looted and burned books, schools and universities and kidnapped and rapped hundreds of young school girls and women. The Taliban were the most misogynist and ignorant rulers, officially banning girls from studying at schools, universities and other educational institutions, kept female teachers and doctors from their jobs and converted girls’ schools into religious madrassas.

RAWA member delivering speech in the conference in Lahore
RAWA representative delivering speech on girl’s education
in Afghanistan in the conference in Lahore, Feb.2, 2006.
The millions Afghan refuges in Pakistan and Iran were the most deprived victims of war and fundamentalists rule. In comparison to the 3 million refugees based in Pakistan, only a few thousand had access to education. Until recently there was no common educational policy. Fundamentalist Jehadi groups and NGOs misused funds they received for education of Afghan refugees. For instance, they would receive funds for 50,000 textbooks to be printed while they would only print 5,000 with very bad quality. More importantly, what was the mentality they were trying to build through their so-called education? Many textbooks were not of any use to the students, as books which were supposed to teach chemistry, biology, physics or Persian… were full of Hadis and Quranic verses. The methods and language used in these books showed no understanding of students, their psychology or their well-being. Imagine children in first and second grade who were learned mathematics like this:

5 guns + 5 guns = 10 guns Or, if a Muslim kills 5 infidels out of 10, how many will left alive?

And the shocking and painful fact is that from the very beginning, the US was the biggest supporter of fundamentalists in educational and cultural fields. As an example, Unocal paid $900,000 to the Center for Afghanistan Studies at the University of Omaha, Nebraska to print textbooks promoting a fundamentalist vision. Two years ago, USAID reprinted through the same university, and these textbooks were no different from those earlier written by Jehadi groups. The Washington Post in March 23, 2002 disclosed only parts of the Jihad Schoolbook Scandal.

As an outcome of this critical situation, Afghanistan has one of the world’s worst literacy rates, estimated by UNICEF at between three to four percent for females and 28 percent for males.

Since once again the fundamentalist jehadis of the “Northern Alliance,” which have long been oppressors and violators of women’s rights and education, are back in power with the support of the US and its allies, no radical change has happened in the economic, social, political and educational life of the people, particularly women. In order to deceive the outside world and make happy their masters, the Northern Alliance pays lip service to democracy and women’s education… but their mentality and treatment of women is the same. The biggest threat to Afghan girl’s education is the domination of “Northern Alliance” criminals. That is why in most provinces girls don’t feel secure, are afraid of going outside their homes and rarely have access to educational institutions near their homes.

12 years old Rahima, who was gang-raped in Takhar province on her way to school and girls like Muska who commit suicide to save their honor are clear examples of what life is like for Afghan girls under the Northern Alliance. In short, for the youth, especially school-going girls, life in Afghanistan is characterized by paralyzing physical danger. As a recently released report by Amnesty International explained, violence against females in the country is such that “Daily Afghan women are at risk of abduction and rape by armed individuals. The government is doing little to improve their condition.” Acts of violence against women are rarely investigated or punished.

Since 1987, RAWA has established a number of schools for the refugee children to impart basic knowledge and modern thoughts that the fundamentalists have denied them. Though our schools were closed due to lack of funds in 1996, we are happy to say that with donations received from supporters around the world, RAWA opened around 15 schools in Pakistan. We also have hundreds of literacy course for Afghan girls and women in almost all provinces of Afghanistan and in refugee camps in Pakistan.

During the Taliban period, RAWA, taking a great risk, managed to organize countless home-based classes throughout Afghanistan. Moreover, RAWA’s orphanages offer safety, shelter, food, clothing and a better quality of education in many cities of Afghanistan and Pakistan for hundreds of children.

With further funds, RAWA hopes to establish schools equipped with laboratories, computers, halls, libraries and other modern facilities throughout Afghanistan.

In order to provide all Afghans with good quality education, schools must remain free of cost from primary level up to university. Because of corrupt political and social system, our people are getting poorer and poorer every day. In such circumstances, talking about privatization of education or the establishment of private institutions will, at the end of the day, only fill foreigners’ packets and expand colonial culture. An American university will open in the near future where only warlord’s children can study. Similarly, because both the ministry of foreign affairs and higher education and the embassies are in the hands of the criminal “Northern Alliance”, scholarships never are given to the deserving students.

Afghanistan is still one of the poorest countries in the world. Just as its economic, cultural and social issues cannot be addressed without a radical change in the political system, its education is also a political phenomenon. By political change I mean the overthrow of the criminal warlord “Northern Alliance,” whose power is the root cause of all the miseries and sufferings of our people. Until and unless these criminals are removed from political power, one can’t hope for an essential change in education sector.

Lastly I would like to say that only those governments, organizations and individuals are true friends of Afghan people who not only don’t consider “Northern Alliance” their friends, but also strongly oppose them. We want you not to be deceived by their fashionable and stylish appearances or their speeches in the name of democracy and women’s rights. Just as our people are suffering from the economic terror, political terror and social terror of the “Northern Alliance”, to same extent are worried about education and the dark fate that is waiting for them without it. This is not only RAWA’s message, but it the voice of our people, who want the world to hear them and join hands with them in their struggle against the enemies of democracy, freedom and peace.

On behalf of RAWA, I once again thank you very much for your kind feelings, support and solidarity with the people of Afghanistan and its freedom-loving organizations.",1353,3.11,0.94,6.29,,,,,,,,,
Non-terrorist,National Rifle Association (NRA),4,0,0,USA,2019,2,Carolyn Meadows,Leader,President of the NRA,"We’re going to work to get Donald Trump reelected, unity, and that’s primarily it, to be politically active, to bring gun-toters into the fold, to get more gun-toters to join NRA . . . “It’s a powerful lobby, not just for gun rights, but for rights. We believe in the Constitution. When we take our oath of office we actually swear allegiance to the Constitution of the United States. That’s why I do it.

There will be more than one person in the race, but we’ll get that seat back. But it is wrong to say like McBath said, that the reason she won was because of her anti-gun stance. That didn’t have anything to do with it,” Meadows said. “It had to do with being a minority female. And the Democrats really turned out, and that’s the problem we have with conservatives — we don’t turn out as well.


This is not [an] NRA position . . . But as far as I’m concerned, I’d love to have a sign out front: ‘We have gun-toting teachers and security.

",177,6.25,1.7,1.7,,,,,,,,,
Non-terrorist,National Rifle Association (NRA),4,0,0,USA,2021,3,Jason Ouimet,Leader,https://www.nraila.org/articles/20210311/statement-on-gun-control-bills-hr-8-and-hr-1446,"These bills are a transparent attempt by gun control advocates in Congress to restrict the rights of law-abiding Americans under the guise of addressing the violent criminal culture in America.  The truth, however, is that neither of these bills will do anything to solve that problem. By giving full power to unelected government bureaucrats to indefinitely delay and prevent lawful firearm transfers, H.R. 1446 could ultimately destroy the Second Amendment rights guaranteed to every law-abiding American by turning it into a privilege enjoyed by a select few.  H.R. 8, so called “universal” background checks, cannot be enforced without a federal gun registry, will not prevent crime, and will turn otherwise law-abiding citizens into criminals for simply loaning a firearm to friends or family members._  If Congress is serious about the safety of law-abiding citizens, it should have passed concealed carry reciprocity so that Americans can safeguard themselves and their families across state lines and throughout our country during these dangerous times.",161,2.99,0.6,9.58,,,,,,,,,
Non-terrorist,National Rifle Association (NRA),4,0,0,USA,2021,3,Jason Ouimet,Leader,https://www.nraila.org/articles/20210303/nra-backed-stand-your-ground-becomes-law-in-arkansas,"This law ensures the rights of law-abiding Arkansans are protected,” said Jason Ouimet, executive director, National Rifle Association Institute for Legislative Action. “Victims have little time to react when confronted with a criminal attack, they should not be required to try and run away before defending themselves. This is a common sense piece of self-defense legislation.”

Senate Bill 24 will strengthen Arkansans' fundamental right to self-defense anywhere they are legally allowed to be.  Law-abiding citizens will no longer be required by law to retreat before using force to defend themselves.  Further, victims of violent crime who respond with defensive force while protecting themselves or their loved ones should not have to face the additional threat of criminal or civil prosecution.

Thirty-four other states have passed stand your ground laws allowing their citizens to more effectively protect themselves instead of forcing unnecessary risks upon them.  

NRA would like to thank House and Senate members who supported this measure, especially bill sponsors, Rep. Aaron Pilkington, and Sen. Bob Ballinger.

“The men and women of the NRA thank the lawmakers in Arkansas who today put the rights of the law-abiding above criminals in Arkansas,” concluded Ouimet. ",190,1.51,0.5,12.06,,,,,,,,,
Non-terrorist,National Rifle Association (NRA),4,0,0,USA,2021,3,Lars Dalseide,Leader,https://www.nraila.org/articles/20210222/nra-victory-in-washington-court-of-appeals,"Today's ruling is an important victory for the people of Washington,"" said Lars Dalseide, NRA Washington state spokesman. ""Hopefully jurisdictions like Edmonds will realize that violating the Washington State Constitution is neither legal nor in the best interest of personal protection.""

The case, Bass v. City of Edmonds, centered on two regulations requiring firearms to be locked at all times within the home and imposed liabilities on gun owners if a prohibited person ever accessed their guns.

""Washington state law prevents local jurisdictions from passing laws that are inconsistent with or more restrictive than state law. We thank the courts for faithfully applying the preemption law and securing the rights of those who choose to protect themselves, their families, and their homes,"" Dalseide concluded. ",122,1.61,1.61,8.06,,,,,,,,,
Non-terrorist,National Rifle Association (NRA),4,0,0,USA,2021,3,n/a,Follower,https://www.nraila.org/articles/20210218/constitutional-carry-passes-in-montana,"On behalf of the NRA's more than five-million members, we thank Gov. Gianforte for his leadership in recognizing the right of law-abiding Montanans to defend themselves and their loved ones without being required to seek government permission,"" said Jason Ouimet, executive director, NRA-ILA. ""The NRA will continue standing up and stepping forward to protect and preserve our most basic, fundamental freedoms here in Montana and across the United States.""

HB 102 strengthens Montana’s self-defense laws by allowing law-abiding Montana gun owners to carry a firearm for self-defense throughout the state without a government-mandated permit. The bill also removes a number of Montana’s “gun-free zones” and ends the unnecessary disarming of Montanans as they go about their day-to-day lives. It does not change prohibited person laws, any law governing the misuse of a firearm, or when force may be used in defense of self or others.

Eighteen states – Alaska, Arizona, Arkansas, Idaho, Kansas, Kentucky, Maine, Mississippi, Missouri, Montana, New Hampshire, North Dakota, Oklahoma, South Dakota, Utah, Vermont, West Virginia, and Wyoming – now allow law-abiding individuals to carry a concealed handgun without a government-issued permit.

The law goes into effect on June 1, 2021.

The NRA thanks the governor and the bill's prime sponsor, Rep. Seth Berglee, for their leadership in advancing the right of self-defense of all Montanans.",215,1.74,1.3,10.87,,,,,,,,,
Non-terrorist,National Rifle Association (NRA),4,0,0,USA,2021,3,n/a,Follower,https://www.nraila.org/articles/20210211/nra-backed-constitutional-carry-passed-in-utah,"“There is no reason a law-abiding person should have to ask for permission to carry a firearm for self-defense,” said Jason Ouimet, executive director, NRA-ILA. ""The passage of this bill demonstrates Utah's commitment to protecting the Second Amendment rights of its citizens."" 

The bill, sponsored by Rep. Walt Brooks and supported by more than three dozen sponsors and co-sponsors, passed both state legislative chambers with overwhelming support. Additionally, this legislation maintains the existing Concealed Firearm Permit (CFP) system, so citizens who wish to obtain a permit for reciprocity in other states may continue to do so. 

“We thank Gov. Cox, Rep. Brooks, and all who supported this important bill,"" Ouimet concluded. ",111,0.87,0.87,6.09,,,,,,,,,
Non-terrorist,International Society for Krishna Consciousness,3,1,0,USA,2015,2,Manorama Das,Leader,https://gbc.iskcon.org/an-interview-with-iskcons-youth-minister/,"The idea for the first bus tour came about at a gurukula reunion in Los Angeles in 1993. A group of us said to ourselves, ‘What if we could organize an extended reunion that was kind of like a spiritual camping and road trip combined? We could visit Los Angeles and San Francisco Ratha-yatras on consecutive weekends, and go camping at national parks along the way.’ It sounded like a plan. With the help of a friend who owned an RV and several people bringing their cars, we went on a road trip in 1994 that turned out to be a success beyond what we had hoped for. Then we heard of this devotee who owned a bus in Denver, Kaliya Damana Prabhu, so we called him up and recruited him. In 1995 we embarked on what became the first bus tour, which we called the Youth Harinama Sankirtana Bus Tour. It included Los Angeles and San Francisco Ratha-yatras, the LA gurukula reunion, camping at national parks, hot springs, and a visit to every temple and devotee home up and down California. And, true to our name, lots of harinamas. Things kind of took off from there. I remember, in 2000, joking with our bus driver about taking the tour across North America, following the Ratha-yatra circuit. We thought it was a crazy idea, that it would take way too much driving, way too much time on the road, way too many advance preparations… The dream stuck, and with the support of Madhuha Prabhu and Festival of India, in 2001 we toured the East Cost, in 2002 the West Coast, and from 2003 on, the entire continent. The rest is, as they say, history. It’s magic. I don’t know exactly what happens, but the formula works. Take 50 devotee youth traveling on a bus tour adventure for six weeks across North America. Add lots of harinama sankirtana, Ratha-yatra festivals, and Holy Name kirtans on festival stages… reading from Krishna Book and Srila Prabhupada Lilamrita at night before we go to bed, living on a Krishna diet… I believe Lord Chaitanya works His magic on their hearts and consciousness. The devotees see how these youth are trying to help do their bit to spread Krishna consciousness far and wide, and they give their blessings, and the whole disciplic succession smiles down upon them, and all these blessings have got to amount to something. You can see the bliss in their eyes when they return from the tour, right? (It inspires me to keep on doing this.) I hope that youth come away from the tour with an experience of how fulfilling life can be when we’re serving Krishna together with love, and sharing that experience with others; that they realize Krishna consciousness is about becoming aware of a transcendent Reality that surrounds us and sustains our very being; that Krishna is supremely relevant to our lives, from the life air that we breathe, to the fire of digestion that keeps us hungry for more prasadam, to the Holy Name who manifests on our tongue and fills our hearts with joy. It’s been great to be able to serve on so many tours with my wife, Jaya Sri Radhe, and we’ve grown closer in our relationship through this service. I’ve had many faith-building experiences on the bus tours that convinced me that God exists, that serving His devotees can be blissfully exhausting at times, and that there’s nothing that gives me more satisfaction than to keep on doing this. When I get home, the first thing I do is sleep for a couple of days to recover. But after a week I’m already thinking about the next tour. The biggest challenge is re-integrating into my routine of working a day job to pay the bills, when my mind is already back on the road, planning the next Krishna conscious adventure bus tour. We held an evening festival attended by about 400 townspeople. After a particularly blissful kirtan with our youth, an elderly lady approached us on stage, accompanied by two assistants. She explained that she had been having dreams of a shaven-headed saffron-clad saintly personality with a golden complexion. She said that during our kirtan she again had a vision of Him, glowing effulgently, like molten gold, dancing in the kirtan. She wondered what the meaning of this was and if we could explain. We brought a copy of the Chaitanya Charitamrita from the bus, and began to show her paintings of Lord Chaitanya. The old lady broke out in tears and exclaimed that this was Him! This was the person she had seen dancing during the kirtan, and the person who had appeared to her in dreams since she was a little girl. She looked at the paintings as if in deep meditation for a while, then thanked us profusely, and gave us some good-luck crystals that she seemed to manifest from her hands, out of thin air. It was truly bizarre. She must have been a yogini of sorts. One of the persons who accompanied her explained that she was a clairvoyant. Moments later she disappeared in the crowds and we have never seen her since. We put the magic crystals she gave us on the bus tour altar as an offering to Sri Sri Gaura Nitai.",887,5.82,1.68,1.12,,,,,,,,,
