Type,Group,viol_relig,relig,viol,Group area of operation,Year,"Text type (1=speech, 2=interview, 3=editorial/press release, 4=tweet, 5=other)",Speaker name,Status,Other notes,rawtext,WC,affiliation,achieve,power,,,,,,,,,
Terrorist,ISIS,1,1,1,Middle East,2008,1,Amedy Coulibaly,Follower,Gunman for ISIS,"I am pledging my allegiance to the Caliph of the Muslims, Abu Bakr al Baghdadi. ""I have made a declaration of allegiance to the Caliph and the declaration of a Caliphate. "" ""I give myself to [long list of names in Arabic which he struggled to read and pronounced] ""We are a team, in league together. I am with the team who did Charlie Hebdo. ""I went out a little against the police too. So that’s that. We did some things together, some things separately to have most impact. [Sound of TV news in the background in which newsreader can be clearly heard talking about the attacks]. ""We have managed to be synchronised together, to come out at the same time, because we are close in the same business. ""Why did you attack France, Charlie Hebdo and a Jewish grocery? [Wearing black leather jacket, black hat and gloves with his AK47 lent next to him against a white wall]) ""What we are in the process of doing is completely legitimate considering what they do... It has been completely deserved for a long time. ""For what you have done to the Caliphate, for what you have done to the Islamic State, we are attacking you. ""You cannot attack us and expect nothing back in return. So, the victims. ""As if you don’t understand why this is happening, for a few dead. This is for you and your coalition, with you at its head. ""You kill there regularly, you use your force, you kill our soldiers. Why? Because we live by Sharia. ""In our state we have decided that is how we live. We will not let you do that. We will fight, if Allah wills it."" ""I am addressing my Muslim brothers, everywhere and in particular in Western countries. ""I ask them 'What are you doing? What are you doing my brothers? What are you doing when they continually insult the Prophet? What are you doing to the aggressors? What do you do when they massacre the entire population?....What are you doing my brothers?' ""Since I got out, I’ve moved around a lot, I’ve visited lots of mosques, in France a little bit and a lot in the Paris region. ""They are all full, full of energy. They are full of sporty youngsters. They are full of men in good health. How do you think with all these thousands and millions of people to defend this?",405,5.68,0.49,2.47,,,,,,,,,
Terrorist,ISIS,1,1,1,Middle East,2014,2,Khalid An-Najdi,Follower,,"I was born in the Arabian Peninsula. I was also a student in the United Kingdom for some time. I decided to write this short message before I do a martyrdom operation. To our brothers in Isl_m who are in the kuf_r countries (America, France, United Kingdom … etc.): You defnitely know what is happening to the Isl_mic ummah and Muslims all over the world. The kuf_r are killing our brothers and raping our sisters while we stand by and do nothing to prevent it, the exact opposite of what Isl_m teaches us. The frst thing I say to Muslims in America and the European countries is that you are in the heart of nations of the kuf_r. You are in a place that too many Mujahedeen wish they were in, so that they can beat the kuf_r in their own countries, destroy their peace as they destroy ours; force them to stop the war against Muslims. And force them to leave the Arabian Peninsula as well as all other Muslim countries, move the war from our lands to theirs and keep fighting them until we let Isl_m rule the whole planet. Being in the heart of the nations of kuf_r is a chance All_h has given you to punish the kuf_r in their own territory. So do not do like I did and leave without doing anything. The second thing is that when you make a small operation in America or European countries you gain more results than a huge operation outside their home. ... And remember that Jih_d is not dependent on a specific person and you are not being asked about what others have done to defend Muslims from the brutish attack on Isl_m. ... All_h will ask you alone about what you did for Isl_m. So do not hesitate or even think twice, all you need is just to follow the steps that the Mujahedeen give you in 'Inspire Magazine' and ask All_h to make it easy for you. ",333,3.63,0.60,4.83,,,,,,,,,
Terrorist,ISIS,1,1,1,Middle East,2015,3,Omar Yimiz,Follower,Ground fighter for ISIS,"“The regime uses chemical warfare on a regular basis these days, and nobody bats an eye—yet when [ISIS] captures it from them and uses it against them it’s all of a sudden a huge problem? Fight them the way they fight you.”",42,0.00,0.00,4.65,,,,,,,,,
Terrorist,ISIS,1,1,1,Middle East,n/a,2,Unknown,Follower,Smuggler for ISIS," I came from a religious family which used to observe all the Islamic traditions. my initial political awareness came during the prayers at the mosque. That’s where I was also asked to join religious classes. In the context of these studies, the sheik used to inject some historical background in which he would tell us how we were effectively evicted from Palestine. The sheik also used to explain to us the significance of the fact that there was an IDF military outpost in the heart of the camp. He compared it to a cancer in the human body, which was threatening its very existence. At the age of 16 I developed an interest in religion. I was exposed to the Moslem Brotherhood and I began to pray in a mosque and to study Islam. The Koran and my religious studies were the tools that shaped my political consciousness. The mosque and the religious clerics in my village provided the focal point of my social life.",165,4.85,0.00,3.03,,,,,,,,,
Terrorist,Islamist,1,1,1,Middle East,n/a,2,n/a,Follower,,"I came from a religious family which used to observe all the Islamic traditions. my initial political awareness came during the prayers at the mosque. That’s where I was also asked to join religious classes. In the context of these studies, the sheik used to inject some historical background in which he would tell us how we were effectively evicted from Palestine.",62,8.06,0.00,1.61,,,,,,,,,
Terrorist,Islamist,1,1,1,Middle East,n/a,2,n/a,Follower,,"The sheik also used to explain to us the significance of the fact that there was an IDF military outpost in the heart of the camp. He compared it to a cancer in the human body, which was threatening its very existence.",42,2.38,0.00,4.76,,,,,,,,,
Terrorist,Islamist,1,1,1,Middle East,n/a,2,n/a,Follower,,At the age of 16 I developed an interest in religion. I was exposed to the Moslem Brotherhood and I began to pray in a mosque and to study Islam. The Koran and my religious studies were the tools that shaped my political consciousness. The mosque and the religious clerics in my village provided the focal point of my social life.,61,3.28,0.00,3.28,,,,,,,,,
Terrorist,Islamist,1,1,1,Middle East,n/a,2,n/a,Follower,,"Families of terrorists who were wounded, killed or captured enjoyed a great deal of economic aid and attention. And that strengthened popular support for the attacks.",26,3.85,0.00,11.54,,,,,,,,,
Terrorist,Unknown,1,1,1,Middle East,n/a,2,n/a,Follower,,"Perpetrators of armed attacks were seen as heroes, their families got a great deal of material assistance, including the construction of new homes to replace those destroyed by the Israeli authorities as punishment for terrorist acts",36,2.78,2.78,13.89,,,,,,,,,
Terrorist,Unknown,1,1,1,Middle East,n/a,2,n/a,Follower,,"The entire family did all it could for the Palestinian people, and won great respect for doing so. All my brothers are in jail, one is serving a life sentence for his activities in the Izz a-Din al-Qassam battalions. My brothers all went to school and most are university graduates.",50,5.77,1.92,1.92,,,,,,,,,
Terrorist,Unknown,1,1,1,Middle East,n/a,2,n/a,Follower,,"Major actions become the subject of sermons in the mosque, glorifying the attack and the attackers.",16,0.00,0.00,18.75,,,,,,,,,
Terrorist,Unknown,1,1,1,Middle East,n/a,2,n/a,Follower,,"Recruits were treated with great respect. a youngster who belonged to Hamas or Fatah was regarded more highly than one who didn’t belong to a group, and got better treatment than unaffiliated kids",33,9.09,3.03,3.03,,,,,,,,,
Terrorist,Unknown,1,1,1,Middle East,n/a,2,n/a,Follower,,Anyone who didn’t enlist during that period (intifada) would have been ostracized.,12,0.00,0.00,0.00,,,,,,,,,
Terrorist,Unknown,1,1,1,Middle East,n/a,2,n/a,Follower,,"You Israelis are Nazis in your souls and in your conduct. In your occupation you never distinguish between men and women, or between old people and children. You adopted methods of collective punishment, you uprooted people from their homeland and from their homes and chased them into exile. You fired live ammunition at women and children. You smashed the skulls of defenseless civilians. You set up detention camps for thousands of people in subhuman conditions. You destroyed homes and turned children into orphans. You prevented people from making a living, you stole their property, you trampled on their honor. Given that kind of conduct, there is no choice but to strike at you without mercy in every possible way.",119,0.00,0.85,6.78,,,,,,,,,
Terrorist,Unknown,1,1,1,Middle East,n/a,2,n/a,Follower,,"And the rank and file were ready to follow through fire and water. I was subordinate to just one person. my relations with him were good, as long as I agreed to all that was asked of me. It was an organization with a very clear hierarchy, and it was clear to me that I was at the bottom or the ladder and that i had to do whatever I was told.",72,1.39,1.39,5.56,,,,,,,,,
Terrorist,Unknown,1,1,1,Middle East,n/a,2,n/a,Follower,,Commanders in the Hamas are commanders in every way. A commander’s orders are absolutely binding and must not be questioned in substance.,22,0.00,0.00,18.18,,,,,,,,,
Terrorist,Unknown,1,1,1,Middle East,n/a,2,n/a,Follower,,"You have to understand that armed attacks are an integral part of the organization’s struggle against the Zionist occupier. There is no other way to redeem the land of Palestine and expel the occupier. Our goals can only be achieved through force, but force is the means, not the end. History shows that without force it will be impossible to achieve independence. Those who carry out the attacks are doing Allah’s work",72,1.39,5.56,8.33,,,,,,,,,
Terrorist,Unknown,1,1,1,Middle East,n/a,2,n/a,Follower,,"The more an attack hurts the enemy, the more important it is. That is the measure. The mass killings, especially the martyrdom operations, were the biggest threat to the Israeli public and so most effort was devoted to these. The extent of the damage and the number of casualties are of primary importance.",53,0.00,3.77,7.55,,,,,,,,,
Terrorist,Unknown,1,1,1,Middle East,n/a,2,n/a,Follower,,"This is not suicide. Suicide is selfish, it is weak, it is mentally disturbed. This is istishad (martyrdom or self sacrifice in the service of Allah.)",26,0.00,0.00,3.85,,,,,,,,,
Terrorist,Unknown,1,1,1,Middle East,n/a,2,n/a,Follower,,"A martyrdom operation is the highest level of jihad, and highlights the depth of our faith. the bombers are holy fighters who carry out one of the more important articles of faith",32,3.12,0.00,6.25,,,,,,,,,
Terrorist,Unknown,1,1,1,Middle East,n/a,2,n/a,Follower,,It is attacks when a member gives his life that earn the most respect and elevate the bombers to the highest possible level of martyrdom.,25,4.00,4.00,12.00,,,,,,,,,
Terrorist,Unknown,1,1,1,Middle East,n/a,2,n/a,Follower,,"I am not a murderer. A murderer is someone with a psychological problem; armed actions have a goal. even if civilians are killed, it is not because we like it or are bloodthirsty. It is a fact of life in a people’s struggle the group doesn’t do it because it wants to kill civilians, but because the jihad must go on.",61,3.28,1.64,1.64,,,,,,,,,
Terrorist,Unknown,1,1,1,Middle East,n/a,2,n/a,Follower,,"I asked Halil what it was all about and he told me that he had been on the wanted list for a long time and did not want to get caught without realizing his dream of being a martyrdom operation bomber. He was completely calm and explained to the other two bombers, Yusuf and Beshar, how to detonate the bombs, exactly the way he had explained things to the bombers in the Mahane Yehuda attack. I remember that besides the tremendous respect I had for Halil and the fact that I was jealous of him, I also felt slighted that he had not asked me to be the third martyrdom operation bomber. I understood that my role in the movement had not come to an end and the fact that I was not on the wanted list and could operate relatively freely could be very advantageous to the movement in the future.",152,0.00,0.66,1.32,,,,,,,,,
Terrorist,Unknown,1,1,1,Middle East,n/a,2,n/a,Follower,,"Personally I made do with a pistol. But I would like the organization to have arms that could wipe out a village or a neighborhood. Atomic and chemical weapons, and things like that, though, frighten me, and I would worry about their impact and consequences of using them. ",48,2.08,0.00,0.00,,,,,,,,,
Terrorist,Unknown,1,1,1,Middle East,n/a,2,n/a,Follower,,That is necessary to defeat the enemy and to liberate our lands and can inflict damage to the enemy.,19,5.26,5.26,5.26,,,,,,,,,
Terrorist,Unknown,1,1,1,Middle East,n/a,2,n/a,Follower,,"As for the question of weapons of mass destruction or nonconventional weapons, the question never arose. All I wanted was a pistol. But we did discuss the subject once. Islam wants to liberate, not kill. Under Islamic law, mass destruction is forbidden. For example, chemical, biological or atomic weapons damage the land and living things, including animals and plants, which are God’s creations. Poisoning wells or rivers is forbidden under Islam",71,1.41,1.41,11.27,,,,,,,,,
Terrorist,Unknown,1,1,1,Middle East,n/a,2,n/a,Follower,,"When it came to moral considerations, we believed in the justice of our cause and in our leaders… I don’t recall ever being troubled by moral questions.",27,11.11,3.70,7.41,,,,,,,,,
Terrorist,Unknown,1,1,1,Middle East,n/a,2,n/a,Follower,,"The organization had no red lines or moral constraints in actions against Jews. Any killing of a Jew was considered a success, and the more the better. The organization has no moral red lines. We must do everything to force the enemy to retreat from out lands. Nothing is illegitimate in achieving this.",53,1.89,5.66,1.89,,,,,,,,,
Terrorist,Unknown,1,1,1,Middle East,n/a,2,n/a,Follower,,"As for the organization’s moral red lines, there were none. We considered every attack on the occupier legitimate. The more you hurt the enemy, the more he understands.",28,3.57,0.00,3.57,,,,,,,,,
Terrorist,Unknown,1,1,1,Middle East,n/a,2,n/a,Follower,,"In a Jihad, there are no red lines.",8,0.00,0.00,0.00,,,,,,,,,
Terrorist,Unknown,1,0,1,Middle East,n/a,2,n/a,Follower,,"As for weapons of mass destruction and unconventional weapons, as an underground organization, we never needed anything more than light automatic weapons and grenades.",24,4.17,0.00,4.17,,,,,,,,,
